MegDaly13,232990205,b'The Oh Hellos closed their Boston show last night with the beautiful ?I Have Made Mistakes.? ??? https://t.co/iJf58ectQk',2018-02-27 04:48:28
coff334Lif3,1220345761,b'Vetting closer to finish #juantopia #hornedman #wepa #celos #red #japaneseinfluence #wip @? https://t.co/TJ1RTea3Hh',2018-02-27 04:46:38
coff334Lif3,1220345761,b'Horned man rough sketch #wip #juantopia #wepa#hornedman#celos #sketch #man #japaneseinfluence? https://t.co/rZGIeRR9KI',2018-02-27 04:45:16
J_FaithOfficial,58364382,b'Make sure you subscribe. Head over to my #YouTubeChannel and check out clips from my performance? https://t.co/jOIGZv8Z8L',2018-02-27 02:18:52
CharlesCulliton,603812490,"b'Prerequisite dark chocolate and coffee, followed by some dark fruit, finished with a tannic rye spiciness. #nybeer? https://t.co/wjRVjMdAsJ'",2018-02-27 01:01:25
bizzie_rhythm,19657794,b'I got to hear a proper bassist play my Trever Smith Signature Fender Precision Bass yesterday? https://t.co/72zpuhGjvr',2018-02-27 01:00:26
YahMoTweetHere,24603157,"b""#BCFCUS Supporter's Summit https://t.co/plBifix2W6""",2018-02-27 00:42:17
lauren10684816,955631436517859328,b'World Record in the 4x800 set on our track!! #yosender https://t.co/vJU63UOfT1',2018-02-27 00:24:35
kimchipapi617,322773109,b'kapture kimchipapikreep ?\n?\n?\n?\n#kimchipapikhronicles? https://t.co/jHPL7F6h2B',2018-02-26 23:20:29
CoachPatMurray,19687223,b'Congrats to Binghamton Alum Jesse Garn and his 4 x 800 team on achieving a new world record.? https://t.co/E1jK6DtUM9',2018-02-26 22:30:27
thewongkid,43388088,"b'2 weeks away, lets get this show on a roll. Better be there!!!? https://t.co/UPgF3rWUXd'",2018-02-26 21:07:50
tmj_bos_finance,23214504,"b'Interested in a #job in #Allston, Massachusetts? This could be a great fit: https://t.co/Aen59viikX #Finance #Hiring #CareerArc'",2018-02-26 19:43:37
GrantSanders,15096830,b'A clip from last night. Go see this band! @theohhellos #theohhellos #realmusic #suchjoy? https://t.co/uCKPPAmyvt',2018-02-26 19:04:59
MattLonergan,54782003,b'Congrats to this NU Husky Foursome for their 4x400m (3:44.98) ECAC Q &amp; 4th All Time performance? https://t.co/Ub5KRW25y3',2018-02-26 16:45:31
OBriensPub02134,78032503,"b'Inspector 34, Babylawns, Sleeping In, and Something//Something at 8 tonight! #allston #uhyeah? https://t.co/EoRrSb11ky'",2018-02-26 15:57:08
lexgordorable,377138139,"b""Just pickled black and yellow mustard seeds with thai chilies, garlic, and dill!!! Can't wait to? https://t.co/zCnkbfzbnK""",2018-02-26 13:32:54
joedunnmusic,43268027,b'Messing around with a @tnaf song ?Young Blood?. It has such a cool hook melody but I have to? https://t.co/aRzyrhNTO3',2018-02-26 06:20:59
williamjepma,509515785,"b'This was a good night. 13/10, would do again. \n@theohhellos https://t.co/Vx9QBzXmfF'",2018-02-26 04:46:35
GrantSanders,15096830,b'Just saw my gazzillionth show at the Paradise. The Oh Hellos. If you have a chance to see them? https://t.co/Ue0FmFFaQZ',2018-02-26 03:41:11
beaupirrone,977017592,"b'such a joy and an honor to see these guys again. i feel like i ran a marathon and leapt off a cliff and just very,? https://t.co/Gp2PgWKjj3'",2018-02-26 03:27:37
thejohnpepe,20638100,b'@theohhellos are pretty great live. @ Paradise Rock Club https://t.co/G59g1ikxnH',2018-02-26 03:14:31
kimchipapi617,322773109,b'be careful if kimchipapikreep sends you noodz? https://t.co/5Z7lVuuhER',2018-02-26 03:13:48
amezbury,1393247112,b'Shabu Zen ?',2018-02-26 03:12:37
connor_mctheman,341081196,b'After watching a WORLD RECORD 4x800m by njnytc none other than @mcmahonjoe snuck me down onto? https://t.co/E9jI9OPQ9s',2018-02-26 02:42:19
runmrsb,1123784012,b'Good race@BULastChance  new PSU record for Warren #fast#proud @ BU Track &amp; Tennis Center https://t.co/IrwcaDAujN',2018-02-26 00:43:45
Nicolearyart,389197467,b'CCM Mass Hockey Jamboree @MassHockeyGirls https://t.co/ORPlFGvlEu',2018-02-26 00:11:51
beaupirrone,977017592,b'ITS HAPPENING!!!!!! https://t.co/BT2sGwpu36',2018-02-25 23:25:42
brianchall,19574611,b'Trudged through the snow in NH to say hello to @theohhellos!',2018-02-25 22:50:34
clodaghscannell,265576365,"b'3 years and 10,592 miles later nothing changed! Missed you so much? https://t.co/2n97MVTo9y'",2018-02-25 21:21:25
tmj_bos_jobs,37935754,"b'SP + is looking for team members who want to drive their career upwards in #Boston, MA! https://t.co/vMwxBXFwBL? https://t.co/BCvHrZUJNk'",2018-02-25 19:44:11
emmettd5,47941264,b'The One Where Lil Turns 23\n?\n?\n?\n?\n?\n?\n#boston #friends #fun #drinks #dancing #taverninthesquare? https://t.co/t5ELSVNJAW',2018-02-25 18:07:11
DjGhettoHype,37841861,b'#Day56 I am My Brothers Keeper. It?s Important to Have Good People around you. It?s important to? https://t.co/kIbEBSQtNy',2018-02-25 17:16:22
CookBagmusic,4886592395,b'TONIGHT//TONIGHT//TONIGHT| 8pm.$8.18+. SEE YA THERE ?\n\n#bostonmusic #bostonmusicscene #punkband? https://t.co/s7OxdesVMo',2018-02-25 16:28:24
crocboots,3115217735,b'A really big mood https://t.co/9YDSt0U4X5',2018-02-25 15:44:07
siisterspooky,94717927,b'it?s been three and a half hours and already i miss my ride or die ?\n.\n.\n#longdistancefriendship? https://t.co/4Q4aS5mWZS',2018-02-25 15:11:29
CoachPatMurray,19687223,b'Stay tune for updates today from the Boston Last Chance Meet as Keishorea Armstrong (Long Jump)? https://t.co/PxBJo8DLVC',2018-02-25 14:44:49
mjfox75,20843199,b'Paradise Rock Club. An evening with Machine Head 2/10/18. @ Paradise Rock Club https://t.co/GGR2C3S24U',2018-02-25 14:14:41
djeloy,18929039,b'My last night in #Boston is at @TavernintheSq come see me now! #djlife #djcityboston #djcity? https://t.co/LgydI4dQOu',2018-02-25 06:01:04
mike_ballz,41274949,b'made new friends @ the gig tonight. thank you phoebe bridgers. nice to meet you conor oberst.? https://t.co/Huc30fdMI7',2018-02-25 04:37:03
codemouse,86240381,b'#deepellum @ Deep Ellum https://t.co/pAqqZUmrGv',2018-02-25 02:55:34
NA98c,924789265309011969,"b""I'm at Brothers Restaurant - @brothersboston in Brookline, MA https://t.co/QECvhP07C5""",2018-02-25 02:15:35
joylesspud,923658193338814464,"b'just wanted to say from the bottom of my tunnel, fuck the Knicks. https://t.co/TYPMAvXN9Z'",2018-02-25 00:42:16
MaYDaRLiNGz,218554040,b'This meal made me full all day. Thanks for invited me @kf_kongfang? https://t.co/ucvTm2tHak',2018-02-25 00:34:38
TheAverageJR,544638989,b'Made Men @ Boston University Athletic Enhancement Center https://t.co/Soc5BgL2QE',2018-02-24 22:34:05
DrPointlessApe,611324191,b'Weekends are for getting Funked up @ Paradise Rock Club https://t.co/aturHtM1ri',2018-02-24 22:11:40
RoadTripNE,429579685,"b'Rainy #Allston evening #neonsign #igersboston @ Allston, Massachusetts https://t.co/ckK3DloVFf'",2018-02-24 21:13:04
sammiedee07,1273676430,b'Flower power ? @ Allston?Brighton https://t.co/ucai2sUW4x',2018-02-24 21:06:47
TotalTrafficBOS,249393984,b'Object on roadway in #Allston on Mass Pike WB at IC 20 - Cambridge St #traffic https://t.co/AoTr5OKtFq',2018-02-24 21:05:19
JustinRocke,136080789,b'Last road game of the regular season as @ArmyWP_WBB takes on @TerrierWBB. Coverage on the Army Sports Network begin? https://t.co/2FX876U84b',2018-02-24 18:39:26
joedunnmusic,43268027,b'I?m super excited to have my @martinguitar back with freshly dressed frets and to have tickets? https://t.co/ZqxiLwTGBQ',2018-02-24 18:37:26
